{"schemaVersion":2,"transcriptId":"tr_low","mediaId":"media_low","durationMs":1000,"languageMode":"auto","detectedLanguages":["en"],"provider":{"name":"example","model":null,"requestId":null,"metadata":{}},"segments":[{"id":"seg_000001","startMs":0,"endMs":1000,"text":"Maybe","originalText":"Maybe","speakerId":null,"language":null,"confidence":0.2,"wordIds":["word_000001"],"timingSource":"estimated","metadata":{}}],"words":[{"id":"word_000001","segmentId":"seg_000001","text":"Maybe","originalText":"Maybe","startMs":null,"endMs":null,"confidence":0.2,"speakerId":null,"language":null,"timingSource":"estimated","isFiller":false,"isLowConfidence":true,"metadata":{}}],"speakers":[],"silenceRegions":[],"quality":{"overallScore":null,"timingScore":null,"confidenceScore":0.2,"lowConfidenceWordCount":1,"untimedWordCount":1,"overlapCount":0,"warnings":[]},"metadata":{},"createdAt":"2026-07-24T12:00:00Z","updatedAt":"2026-07-24T12:00:00Z"}
