{"schemaVersion":2,"transcriptId":"tr_overlap","mediaId":"media_overlap","durationMs":3000,"languageMode":"auto","detectedLanguages":["en"],"provider":{"name":"example","model":null,"requestId":null,"metadata":{}},"segments":[{"id":"seg_000001","startMs":0,"endMs":1400,"text":"One","originalText":"One","speakerId":"speaker_000001","language":"en","confidence":null,"wordIds":[],"timingSource":"provider","metadata":{}},{"id":"seg_000002","startMs":1000,"endMs":2000,"text":"Two","originalText":"Two","speakerId":"speaker_000002","language":"en","confidence":null,"wordIds":[],"timingSource":"provider","metadata":{}}],"words":[],"speakers":[{"id":"speaker_000001","label":"Speaker 1","displayName":null,"confidence":null,"metadata":{}},{"id":"speaker_000002","label":"Speaker 2","displayName":null,"confidence":null,"metadata":{}}],"silenceRegions":[],"quality":{"overallScore":null,"timingScore":null,"confidenceScore":null,"lowConfidenceWordCount":0,"untimedWordCount":0,"overlapCount":1,"warnings":["Overlapping segments are valid; consumers must render by time and speaker."]},"metadata":{},"createdAt":"2026-07-24T12:00:00Z","updatedAt":"2026-07-24T12:00:00Z"}
