{"schemaVersion":2,"transcriptId":"tr_hinglish","mediaId":"media_hinglish","durationMs":2000,"languageMode":"hinglish","detectedLanguages":["hi","en"],"provider":{"name":"sarvam","model":null,"requestId":null,"metadata":{}},"segments":[{"id":"seg_000001","startMs":0,"endMs":1000,"text":"Aaj meeting hai.","originalText":"Aaj meeting hai.","speakerId":null,"language":"hi","confidence":null,"wordIds":[],"timingSource":"provider","metadata":{}}],"words":[],"speakers":[],"silenceRegions":[],"quality":{"overallScore":null,"timingScore":null,"confidenceScore":null,"lowConfidenceWordCount":0,"untimedWordCount":0,"overlapCount":0,"warnings":[]},"metadata":{},"createdAt":"2026-07-24T12:00:00Z","updatedAt":"2026-07-24T12:00:00Z"}
