{"schemaVersion":2,"transcriptId":"tr_empty","mediaId":"media_empty","durationMs":0,"languageMode":"auto","detectedLanguages":[],"provider":{"name":"unknown","model":null,"requestId":null,"metadata":{}},"segments":[],"words":[],"speakers":[],"silenceRegions":[],"quality":{"overallScore":null,"timingScore":null,"confidenceScore":null,"lowConfidenceWordCount":0,"untimedWordCount":0,"overlapCount":0,"warnings":[]},"metadata":{},"createdAt":"2026-07-24T12:00:00Z","updatedAt":"2026-07-24T12:00:00Z"}
