{"schemaVersion":2,"transcriptId":"tr_telgish","mediaId":"media_telgish","durationMs":2000,"languageMode":"auto","detectedLanguages":["te","en"],"provider":{"name":"example","model":null,"requestId":null,"metadata":{}},"segments":[{"id":"seg_000001","startMs":100,"endMs":900,"text":"Meeting start చేద్దాం","originalText":"Meeting start చేద్దాం","speakerId":null,"language":"te","confidence":null,"wordIds":["word_000001"],"timingSource":"manuallyAdjusted","metadata":{}}],"words":[{"id":"word_000001","segmentId":"seg_000001","text":"Meeting","originalText":"Meeting","startMs":100,"endMs":500,"confidence":null,"speakerId":null,"language":"en","timingSource":"manuallyAdjusted","isFiller":false,"isLowConfidence":false,"metadata":{}}],"speakers":[],"silenceRegions":[],"quality":{"overallScore":null,"timingScore":null,"confidenceScore":null,"lowConfidenceWordCount":0,"untimedWordCount":0,"overlapCount":0,"warnings":[]},"metadata":{},"createdAt":"2026-07-24T12:00:00Z","updatedAt":"2026-07-24T12:00:00Z"}
