{"schemaVersion":2,"transcriptId":"tr_english","mediaId":"media_english","durationMs":3000,"languageMode":"auto","detectedLanguages":["en"],"provider":{"name":"sarvam","model":"saaras-v3","requestId":null,"metadata":{"region":"in"}},"segments":[{"id":"seg_000001","startMs":0,"endMs":1200,"text":"Hello world.","originalText":"Hello world.","speakerId":null,"language":"en","confidence":0.95,"wordIds":["word_000001","word_000002"],"timingSource":"provider","metadata":{}}],"words":[{"id":"word_000001","segmentId":"seg_000001","text":"Hello","originalText":"Hello","startMs":0,"endMs":500,"confidence":0.96,"speakerId":null,"language":"en","timingSource":"provider","isFiller":false,"isLowConfidence":false,"metadata":{}},{"id":"word_000002","segmentId":"seg_000001","text":"world.","originalText":"world.","startMs":510,"endMs":1200,"confidence":0.94,"speakerId":null,"language":"en","timingSource":"provider","isFiller":false,"isLowConfidence":false,"metadata":{}}],"speakers":[],"silenceRegions":[],"quality":{"overallScore":null,"timingScore":null,"confidenceScore":null,"lowConfidenceWordCount":0,"untimedWordCount":0,"overlapCount":0,"warnings":[]},"metadata":{},"createdAt":"2026-07-24T12:00:00Z","updatedAt":"2026-07-24T12:00:00Z"}
